<?php

return [
  'h1' => 'Opinie',
  'lead' => 'Kilka słów od osób, które uczą się ze mną online.',
  'items' => [
    [
      'name' => 'Anna',
      'rating' => 5,
      'date' => '18.02.2022',
      'date_iso' => '2022-02-18',
      'text' => 'Serdecznie polecam panią Aleksandrę — jest miła, serdeczna i bardzo cierpliwa dla swoich uczniów. Do tego piękna kobieta z wielką wiedzą. Czego chcieć więcej?',
    ],
    [
      'name' => 'Marta',
      'rating' => 5,
      'date' => '01.02.2023',
      'date_iso' => '2023-02-01',
      'text' => 'Jestem bardzo zadowolona z lekcji z Aleksandrą. Na zajęciach panuje miła atmosfera, a wszystkie zagadnienia są jasno i zrozumiale wytłumaczone.',
    ],
    [
      'name' => 'Martyna',
      'rating' => 5,
      'date' => '05.07.2023',
      'date_iso' => '2023-07-05',
      'text' => 'Zajęcia w bardzo przyjemnej atmosferze, z dobrze ułożonym planem tematów, dostosowanym akurat pod moje potrzeby. Znalazłam się w dość nietypowej sytuacji, gdzie jednocześnie potrzebowałam podstaw włoskiego od zera oraz terminologii medycznej i udało się to z sukcesem połączyć ;) Do tego zajęcia bardzo zróżnicowane, tak aby ćwiczyć każdy aspekt języka oraz duża swoboda jeśli chodzi o dopasowanie terminów. Polecam!',
    ],
    [
      'name' => 'Steph',
      'rating' => 5,
      'date' => '12.08.2023',
      'date_iso' => '2023-08-12',
      'text' => 'Współpraca z Aleksandrą jest naprawdę świetna. Już od pierwszej lekcji rozmawialiśmy po polsku, a ona udzieliła mi bardzo cennych wskazówek, jak najlepiej wykorzystać naszą wspólną pracę.
Szczególnie podoba mi się to, że znalazła mi również partnera do nauki, dzięki czemu możemy przerabiać materiał razem jako para początkujących.',
    ],
    [
      'name' => 'Ellen',
      'rating' => 5,
      'date' => '22.09.2024',
      'date_iso' => '2023-09-22',
      'text' => 'Bardzo lubię lekcje z Aleksandrą. Jest świetnie zorganizowana, doskonale przygotowana i mocno skupiona na moich postępach. Z całego serca polecam współpracę z nią!',
    ],
    [
      'name' => 'Olenka',
      'rating' => 5,
      'date' => '14.10.2023',
      'date_iso' => '2023-10-14',
      'text' => 'Aleksandra jest niezwykle zorganizowaną, cierpliwą i życzliwą nauczycielką, z niesamowitą energią. Czas na zajęciach mija błyskawicznie, a ja uczę się naprawdę dużo! Za każdym razem jest świetnie przygotowana – ma jasno określony plan i temat lekcji oraz bardzo dobre tempo pracy.
Nigdy nie mam wrażenia, że marnujemy czas albo że coś jest dla mnie niejasne. Uczyłem/uczyłam się wielu języków w swoim życiu i Aleksandra zdecydowanie należy do najlepszych nauczycieli, z jakimi pracowałem/pracowałam. Dziękuję!',
    ],
    [
      'name' => 'Alexandra',
      'rating' => 5,
      'date' => '12.01.2026',
      'date_iso' => '2026-01-12',
      'text' => 'Idealnie! Sto procent, nie czekaj!!
Aleksandra jest doskonałą nauczycielką języka polskiego i włoskiego. Postawiłem/postawiłam przed nią wyzwanie: pomóc mi poprawić mój polski, a jednocześnie nauczyć mnie nowego języka – włoskiego. Jej biegłość oraz umiejętności dydaktyczne w obu językach są naprawdę imponujące.
W przypadku języka polskiego korzysta z różnorodnych materiałów – od nagrań audio po artykuły – dzięki czemu nauka jest ciekawa i wymagająca. Jeśli chodzi o język włoski, pracujemy w bardziej tradycyjny sposób, z podręcznikiem, aby solidnie opanować podstawy.
Dodatkowo Aleksandra jest bardzo elastyczna w kwestii terminów, świetnie się komunikuje i naprawdę rozumie moje potrzeby oraz cele. Z całego serca polecam naukę jednego lub obu języków właśnie z nią.
Wspomniałem/wspomniałam też, że często gubię papierowe notatki, a ona okazała się bardzo wyrozumiała i zaproponowała prowadzenie „żywego” dokumentu w Wordzie, który aktualizujemy na bieżąco wraz z nowymi materiałami.',
    ],
    [
      'name' => 'Charles',
      'rating' => 5,
      'date' => '23.07.2025',
      'date_iso' => '2025-07-23',
      'text' => 'Aleksandra jest bardzo dobrze zorganizowana. Zawsze przychodzi na zajęcia z przygotowanym planem lekcji i świetnie wszystko tłumaczy. Poświęca czas na odpowiadanie na pytania i dokłada wszelkich starań, aby upewnić się, że materiał jest w pełni zrozumiały. Zdecydowanie ją polecam.',
    ],
     [
      'name' => 'Emily',
      'rating' => 5,
      'date' => '01.05.2025',
      'date_iso' => '2025-05-01',
      'text' => 'Moja nauczycielka języka włoskiego Aleksandra jest niezwykle profesjonalna i zawsze świetnie przygotowana do zajęć. Wszystko tłumaczy jasno i zrozumiale, dzięki czemu nawet trudniejsze zagadnienia stają się łatwe do opanowania. Zajęcia są tak angażujące, że za każdym razem godzina mija w mgnieniu oka.',
    ],
    [
      'name' => 'Piotr',
      'rating' => 5,
      'date' => '14.05.2022',
      'date_iso' => '2022-05-14',
      'text' => 'Zajęcia odbywają się w bardzo przyjemnej atmosferze. Harmonogram nie jest stały, co daje pewną elastyczność. Program przystępny dla osoby początkującej, a czas leci bardzo szybko. Szczerze polecam!:)',
    ],
     [
      'name' => 'Karina',
      'rating' => 5,
      'date' => '15.10.2021',
      'date_iso' => '2021-10-15',
      'text' => 'Córka jest zachwycona lekcjami z panią Aleksandra. Jest bardzo miła i ciepła osoba, ze świetnym podejściem do dzieci (córka 10 lat). Zawsze perfekcyjnie i profesjonalnie przygotowana do zajęć, punktualna. Po skończonej lekcji córka dostaje od korepetytora e-mailem notatki z prowadzonej lekcji. Polecam wszystkim zainteresowanym!',
    ],
  ]
];